{
  "schema_version": "0.1.0",
  "artifact_id": "fa_435de0b96a8f237b",
  "status": "scored",
  "supersedes": "fa_1e7e72b97f5ef903",
  "match": {
    "match_id": "wc2026_qf_mex_cro",
    "competition": "FIFA World Cup 2026",
    "stage": "Quarter-final",
    "kickoff_utc": "2026-07-07T20:00:00Z",
    "home_team": "Mexico",
    "away_team": "Croatia",
    "neutral_venue": false,
    "city": "Guadalajara",
    "country": "Mexico"
  },
  "forecast": {
    "market": "1x2_regulation",
    "sealed_at_utc": "2026-07-06T20:00:00Z",
    "horizon": "T-24h",
    "probs": {
      "home": 0.44,
      "draw": 0.29,
      "away": 0.27
    },
    "expected_goals": {
      "home": 1.4,
      "away": 1.1
    },
    "abstained": false,
    "abstain_reason": null,
    "uncertainty": "medium"
  },
  "model": {
    "model_id": "elo-v2.3.1",
    "family": "elo_ordlogit",
    "version": "2.3.1",
    "params_hash": "74904326dd47a525e6a4fd2d6922dfe1fb01d34b4b94ba49b8a003d56336406b",
    "code_git_sha": "8a9b4a77f30de06eeaf3e2b77a3f1d62ff918b4c",
    "seed": 20260609
  },
  "inputs": {
    "training_cutoff_utc": "2026-06-05T00:00:00Z",
    "snapshots": [
      {
        "snapshot_id": "snap_cd87443cf1fb",
        "source_id": "martj42/international_results",
        "url": "https://github.com/martj42/international_results",
        "upstream_ref": "e4b7f10",
        "retrieved_at_utc": "2026-07-06T19:05:00Z",
        "sha256": "bfc56374b744652ce5c3eab43963925735c279039dccba60d67cf0f0107a0c03",
        "license": "CC0-1.0"
      },
      {
        "snapshot_id": "snap_91c52a7ea831",
        "source_id": "golavo/elo_ratings",
        "url": "https://github.com/udhawan97/Golavo/tree/main/packs/ratings",
        "upstream_ref": "2026-07-06",
        "retrieved_at_utc": "2026-07-06T19:06:00Z",
        "sha256": "641ec8a3e1d1e44eebb5f341c7c3336e921c8c98fd5e6f477d9f728b8b37e62e",
        "license": "CC0-1.0"
      }
    ]
  },
  "provenance": {
    "created_at_utc": "2026-07-06T20:00:00Z",
    "generator": "golavo-engine 8a9b4a7",
    "deterministic": true,
    "payload_sha256": "4540e6cdd76f92570c3203b7ae3bc57c9bdcb9da0a5d84b60241a78aed6877b0"
  },
  "evaluation": {
    "actual": {
      "home_goals": 2,
      "away_goals": 1,
      "outcome": "home"
    },
    "scored_at_utc": "2026-07-07T22:00:00Z",
    "metrics": {
      "log_loss": 0.821,
      "brier": 0.471,
      "prob_assigned_to_outcome": 0.44
    }
  }
}
