{"artifact_id":"fa_be978bcb4a1c25e59374","evaluation":null,"forecast":{"abstain_reason":"synthetic insufficient-data fixture","abstained":true,"expected_goals":null,"horizon":"T-24h","market":"1x2_regulation","probs":null,"sealed_at_utc":"2030-01-16T18:00:00Z","uncertainty":"high"},"inputs":{"snapshots":[{"license":"CC0-1.0 excerpt; synthetic fields are test-only","retrieved_at_utc":"2030-01-01T00:00:00Z","sha256":"efd0adeb029fa164d1476de54a5a953d0cf7d037ea0bebca92f36a96a6ece9c9","snapshot_id":"sp_synthetic_fixture_v1","source_id":"golavo-synthetic-contract-fixtures","upstream_ref":"phase0-fixtures-v1","url":"https://github.com/udhawan97/Golavo/tree/main/data/fixtures"}],"training_cutoff_utc":"2030-01-16T18:00:00Z"},"match":{"away_team":"Example Away 7","city":"Example City","competition":"Synthetic contract fixture","country":"Example Country","home_team":"Example Home 7","kickoff_utc":"2030-01-17T18:00:00Z","match_id":"m_synthetic_07","neutral_venue":false,"stage":"Acceptance test"},"model":{"code_git_sha":"0000000","family":"poisson_independent","model_id":"synthetic_contract_fixture","params_hash":"5f1b3431408401f9d68b5ee37a843f3618480a2e3689ca58ffcf6791f4e643c6","seed":20260710,"version":"0.1.0"},"provenance":{"created_at_utc":"2030-01-16T18:00:00Z","deterministic":true,"generator":"golavo-sample-fixtures/0.2.0","payload_sha256":"9884ac72af2809ff4b085065659971cee4b1174c045fa028e4e73edc09c87ecc"},"schema_version":"0.2.0","status":"abstained","supersedes":null}
