{"artifact_id":"fa_b44892255616a50d59bb","evaluation":null,"forecast":{"abstain_reason":null,"abstained":false,"expected_goals":null,"horizon":"T-24h","market":"1x2_regulation","probs":{"away":0.279321,"draw":0.271049,"home":0.44963},"sealed_at_utc":"2026-07-08T00:00:00Z","uncertainty":"low"},"inputs":{"snapshots":[{"license":"CC0-1.0","retrieved_at_utc":"2026-07-11T04:36:22Z","sha256":"6053477001b887b69d97ce7ff89ec4d55f34b0e1b0513b29d22fe26a7fc39899","snapshot_id":"sp_273c731492df","source_id":"martj42-international-results","upstream_committed_at_utc":"2026-07-07T23:01:13Z","upstream_ref":"273c731492df960cae363317e8e78e2be4b4b7cf","url":"https://github.com/martj42/international_results"}],"training_cutoff_utc":"2026-07-08T00:00:00Z"},"match":{"away_team":"Morocco","city":"Foxborough","competition":"FIFA World Cup","country":"United States","home_team":"France","kickoff_utc":"2026-07-09T00:00:00Z","match_id":"m_4c107c1bc7e11203","neutral_venue":true,"stage":null},"model":{"code_git_sha":"0000000","family":"elo_ordlogit","model_id":"elo_ordlogit_phase0","params_hash":"19f07f97353dbc2ac21073f68770a0eb5ea1f5110b4096a79e295a40f839486d","seed":20260710,"version":"0.1.0"},"provenance":{"created_at_utc":"2026-07-08T00:00:00Z","deterministic":true,"generator":"golavo-core/0.1.0","payload_sha256":"8c75694ad0711bee37c3d4e115b5bf5d9ede4c42d960487e7d4561ba404fa469"},"schema_version":"0.2.0","status":"sealed","supersedes":null}
