{"artifact_id":"fa_13876f8e7f3c904eb731","evaluation":{"actual":{"away_goals":1,"home_goals":2,"outcome":"home"},"metrics":{"brier":0.3758,"log_loss":0.693147,"prob_assigned_to_outcome":0.5},"scored_at_utc":"2030-02-01T00:00:00Z"},"forecast":{"abstain_reason":null,"abstained":false,"expected_goals":{"away":1.08,"home":1.42},"horizon":"T-24h","market":"1x2_regulation","probs":{"away":0.23,"draw":0.27,"home":0.5},"sealed_at_utc":"2030-01-13T18:00:00Z","uncertainty":"low"},"inputs":{"snapshots":[{"license":"CC0-1.0 excerpt; synthetic fields are test-only","retrieved_at_utc":"2030-01-01T00:00:00Z","sha256":"efd0adeb029fa164d1476de54a5a953d0cf7d037ea0bebca92f36a96a6ece9c9","snapshot_id":"sp_synthetic_fixture_v1","source_id":"golavo-synthetic-contract-fixtures","upstream_ref":"phase0-fixtures-v1","url":"https://github.com/udhawan97/Golavo/tree/main/data/fixtures"}],"training_cutoff_utc":"2030-01-13T18:00:00Z"},"match":{"away_team":"Example Away 4","city":"Example City","competition":"Synthetic contract fixture","country":"Example Country","home_team":"Example Home 4","kickoff_utc":"2030-01-14T18:00:00Z","match_id":"m_synthetic_04","neutral_venue":true,"stage":"Acceptance test"},"model":{"code_git_sha":"0000000","family":"poisson_independent","model_id":"synthetic_contract_fixture","params_hash":"5f1b3431408401f9d68b5ee37a843f3618480a2e3689ca58ffcf6791f4e643c6","seed":20260710,"version":"0.1.0"},"provenance":{"created_at_utc":"2030-02-01T00:00:00Z","deterministic":true,"generator":"golavo-sample-fixtures/0.2.0","payload_sha256":"d6718b9b16821e11ec10f85d62bb42ce46a6ce0103c2bab44343b6d5e6634a57"},"schema_version":"0.2.0","status":"scored","supersedes":"fa_d261c2f828520f4d82f1"}
