{
  "schema_version": "0.1.0",
  "artifact_id": "fa_b1af0c2e4b125389",
  "status": "voided",
  "supersedes": null,
  "match": {
    "match_id": "wc2026_r16_bel_uru",
    "competition": "FIFA World Cup 2026",
    "stage": "Round of 16",
    "kickoff_utc": "2026-07-06T16:00:00Z",
    "home_team": "Belgium",
    "away_team": "Uruguay",
    "neutral_venue": true,
    "city": "Guadalajara",
    "country": "Mexico"
  },
  "forecast": {
    "market": "1x2_regulation",
    "sealed_at_utc": "2026-07-05T16:00:00Z",
    "horizon": "T-24h",
    "probs": {
      "home": 0.43,
      "draw": 0.28,
      "away": 0.29
    },
    "expected_goals": {
      "home": 1.4,
      "away": 1.1
    },
    "abstained": false,
    "abstain_reason": null,
    "uncertainty": "medium"
  },
  "model": {
    "model_id": "bvp-v1.6.2",
    "family": "bivariate_poisson",
    "version": "1.6.2",
    "params_hash": "f9be096585b07adbe8d1e05e2deef110d3eaefd01f24bc6fe6f94bfb65bfe64a",
    "code_git_sha": "0533b20be91f4919450544253d7a57cb419ce5fb",
    "seed": 20260607
  },
  "inputs": {
    "training_cutoff_utc": "2026-06-01T00:00:00Z",
    "snapshots": [
      {
        "snapshot_id": "snap_a8d8e5c81c5f",
        "source_id": "martj42/international_results",
        "url": "https://github.com/martj42/international_results",
        "upstream_ref": "d0a91c7",
        "retrieved_at_utc": "2026-07-05T15:05:00Z",
        "sha256": "402a05ca37f389d22ea7f6ddd8ebcd271b79496ce5a3f050f336042b497d4142",
        "license": "CC0-1.0"
      }
    ]
  },
  "provenance": {
    "created_at_utc": "2026-07-05T16:00:00Z",
    "generator": "golavo-engine 0533b20",
    "deterministic": true,
    "payload_sha256": "cee84cdad9d1f7f06c87d3a703744608515c7047271e89cf697d155cd737235a"
  },
  "evaluation": null
}
