{
  "schema_version": "0.1.0",
  "artifact_id": "fa_1e7e72b97f5ef903",
  "status": "sealed",
  "supersedes": null,
  "match": {
    "match_id": "wc2026_qf_mex_cro",
    "competition": "FIFA World Cup 2026",
    "stage": "Quarter-final",
    "kickoff_utc": "2026-07-07T20:00:00Z",
    "home_team": "Mexico",
    "away_team": "Croatia",
    "neutral_venue": false,
    "city": "Guadalajara",
    "country": "Mexico"
  },
  "forecast": {
    "market": "1x2_regulation",
    "sealed_at_utc": "2026-07-04T20:00:00Z",
    "horizon": "T-72h",
    "probs": {
      "home": 0.4,
      "draw": 0.3,
      "away": 0.3
    },
    "expected_goals": {
      "home": 1.3,
      "away": 1.2
    },
    "abstained": false,
    "abstain_reason": null,
    "uncertainty": "high"
  },
  "model": {
    "model_id": "elo-v2.3.0",
    "family": "elo_ordlogit",
    "version": "2.3.0",
    "params_hash": "c21ca383d8f86a1b55f58af12f099dc7a5bfedc317ae24b41bd65fbf372610ce",
    "code_git_sha": "0533b20be91f4919450544253d7a57cb419ce5fb",
    "seed": 20260608
  },
  "inputs": {
    "training_cutoff_utc": "2026-06-01T00:00:00Z",
    "snapshots": [
      {
        "snapshot_id": "snap_a8d8e5c81c5f",
        "source_id": "martj42/international_results",
        "url": "https://github.com/martj42/international_results",
        "upstream_ref": "d0a91c7",
        "retrieved_at_utc": "2026-07-04T19:05:00Z",
        "sha256": "402a05ca37f389d22ea7f6ddd8ebcd271b79496ce5a3f050f336042b497d4142",
        "license": "CC0-1.0"
      },
      {
        "snapshot_id": "snap_8d3fe4ecaddf",
        "source_id": "golavo/elo_ratings",
        "url": "https://github.com/udhawan97/Golavo/tree/main/packs/ratings",
        "upstream_ref": "2026-07-01",
        "retrieved_at_utc": "2026-07-04T19:06:00Z",
        "sha256": "14c831552d92d14df82787fdf10f016f6421d10ca7b27121de526fe31ded8163",
        "license": "CC0-1.0"
      }
    ]
  },
  "provenance": {
    "created_at_utc": "2026-07-04T20:00:00Z",
    "generator": "golavo-engine 0533b20",
    "deterministic": true,
    "payload_sha256": "35849b2565ec7cd84f67e91bb9a3b3da1668a27788745609ad3b0a6741c253cd"
  },
  "evaluation": null
}
