{"artifact_id":"fa_d9725b47330bd6612ce9","evaluation":{"actual":{"away_goals":1,"home_goals":0,"outcome":"away"},"metrics":{"brier":0.9414,"log_loss":1.514128,"prob_assigned_to_outcome":0.22},"scored_at_utc":"2030-02-01T00:00:00Z"},"forecast":{"abstain_reason":null,"abstained":false,"expected_goals":{"away":1.08,"home":1.42},"horizon":"T-60m","market":"1x2_regulation","probs":{"away":0.22,"draw":0.27,"home":0.51},"sealed_at_utc":"2030-01-14T18:00:00Z","uncertainty":"medium"},"inputs":{"snapshots":[{"license":"CC0-1.0 excerpt; synthetic fields are test-only","retrieved_at_utc":"2030-01-01T00:00:00Z","sha256":"efd0adeb029fa164d1476de54a5a953d0cf7d037ea0bebca92f36a96a6ece9c9","snapshot_id":"sp_synthetic_fixture_v1","source_id":"golavo-synthetic-contract-fixtures","upstream_ref":"phase0-fixtures-v1","url":"https://github.com/udhawan97/Golavo/tree/main/data/fixtures"}],"training_cutoff_utc":"2030-01-14T18:00:00Z"},"match":{"away_team":"Example Away 5","city":"Example City","competition":"Synthetic contract fixture","country":"Example Country","home_team":"Example Home 5","kickoff_utc":"2030-01-15T18:00:00Z","match_id":"m_synthetic_05","neutral_venue":false,"stage":"Acceptance test"},"model":{"code_git_sha":"0000000","family":"dixon_coles","model_id":"synthetic_contract_fixture","params_hash":"5f1b3431408401f9d68b5ee37a843f3618480a2e3689ca58ffcf6791f4e643c6","seed":20260710,"version":"0.1.0"},"provenance":{"created_at_utc":"2030-02-01T00:00:00Z","deterministic":true,"generator":"golavo-sample-fixtures/0.2.0","payload_sha256":"732279fbc1b94c592793d3fd6d1a655c6369e38bbf0df29a8ea6052231ae180b"},"schema_version":"0.2.0","status":"scored","supersedes":"fa_b616e07ee8faf712ff03"}
