{
  "schema_version": "0.1.0",
  "artifact_id": "fa_ab7bc3da29f835d6",
  "status": "scored",
  "supersedes": null,
  "match": {
    "match_id": "wc2026_qf_ned_bra",
    "competition": "FIFA World Cup 2026",
    "stage": "Quarter-final",
    "kickoff_utc": "2026-07-08T16:00:00Z",
    "home_team": "Netherlands",
    "away_team": "Brazil",
    "neutral_venue": true,
    "city": "Atlanta",
    "country": "United States"
  },
  "forecast": {
    "market": "1x2_regulation",
    "sealed_at_utc": "2026-07-07T16:00:00Z",
    "horizon": "T-24h",
    "probs": {
      "home": 0.32,
      "draw": 0.3,
      "away": 0.38
    },
    "expected_goals": {
      "home": 1.2,
      "away": 1.3
    },
    "abstained": false,
    "abstain_reason": null,
    "uncertainty": "high"
  },
  "model": {
    "model_id": "poi-v2.0.4",
    "family": "poisson_independent",
    "version": "2.0.4",
    "params_hash": "1a1dab9b81f6060f47baabfd1bf774575e8729f1573b33fc897878557bfe37ed",
    "code_git_sha": "0533b20be91f4919450544253d7a57cb419ce5fb",
    "seed": 20260604
  },
  "inputs": {
    "training_cutoff_utc": "2026-06-01T00:00:00Z",
    "snapshots": [
      {
        "snapshot_id": "snap_7a0eadaa4f62",
        "source_id": "martj42/international_results",
        "url": "https://github.com/martj42/international_results",
        "upstream_ref": "c33f8b2",
        "retrieved_at_utc": "2026-07-07T15:20:00Z",
        "sha256": "ff6b4c2f09f281c7b00bc386f4326efbaf4a1c6b596a750b60d6c600b8649d6c",
        "license": "CC0-1.0"
      }
    ]
  },
  "provenance": {
    "created_at_utc": "2026-07-07T16:00:00Z",
    "generator": "golavo-engine 0533b20",
    "deterministic": true,
    "payload_sha256": "772393c3583b61e2a7f6a67568dae5d0b08a75282eb3eaf040b17f331b5ebad9"
  },
  "evaluation": {
    "actual": {
      "home_goals": 1,
      "away_goals": 1,
      "outcome": "draw"
    },
    "scored_at_utc": "2026-07-08T18:00:00Z",
    "metrics": {
      "log_loss": 1.204,
      "brier": 0.737,
      "prob_assigned_to_outcome": 0.3
    }
  }
}
