{"artifact_id":"fa_4d526254524b29c609e2","evaluation":null,"forecast":{"abstain_reason":null,"abstained":false,"expected_goals":{"away":1.2,"home":1.35},"horizon":"T-60m","market":"1x2_regulation","probs":{"away":0.321463,"draw":0.28626,"home":0.392277},"score_matrix":{"grid":[[0.08820105,0.083578615,0.0562188,0.02248752,0.006746256,0.001619101,0.00032382,5.5512e-05],[0.095290865,0.136611683,0.075895379,0.030358152,0.009107446,0.002185787,0.000437157,7.4941e-05],[0.071151918,0.085382302,0.051229381,0.020491752,0.006147526,0.001475406,0.000295081,5.0585e-05],[0.032018363,0.038422036,0.023053221,0.009221289,0.002766387,0.000663933,0.000132787,2.2763e-05],[0.010806198,0.012967437,0.007780462,0.003112185,0.000933655,0.000224077,4.4815e-05,7.683e-06],[0.002917673,0.003501208,0.002100725,0.00084029,0.000252087,6.0501e-05,1.21e-05,2.074e-06],[0.000656477,0.000787772,0.000472663,0.000189065,5.672e-05,1.3613e-05,2.723e-06,4.67e-07],[0.000126606,0.000151927,9.1156e-05,3.6463e-05,1.0939e-05,2.625e-06,5.25e-07,9e-08]],"max_goals":7,"most_likely":{"away":1,"home":1,"probability":0.136611683},"resolution":20,"tail":{"away":3.6976e-05,"draw":2e-09,"home":8.3206e-05,"probability":0.000120184},"total_probability":0.999999999},"sealed_at_utc":"2030-01-11T18:00:00Z","uncertainty":"low"},"inputs":{"snapshots":[{"license":"CC0-1.0 excerpt; synthetic fields are test-only","retrieved_at_utc":"2030-01-01T00:00:00Z","sha256":"efd0adeb029fa164d1476de54a5a953d0cf7d037ea0bebca92f36a96a6ece9c9","snapshot_id":"sp_synthetic_fixture_v1","source_id":"golavo-synthetic-contract-fixtures","upstream_ref":"phase0-fixtures-v1","url":"https://github.com/udhawan97/Golavo/tree/main/data/fixtures"}],"training_cutoff_utc":"2030-01-11T18:00:00Z"},"match":{"away_team":"Example Away 2","city":"Example City","competition":"Synthetic contract fixture","country":"Example Country","home_team":"Example Home 2","kickoff_utc":"2030-01-12T18:00:00Z","match_id":"m_synthetic_02","neutral_venue":true,"stage":"Acceptance test"},"model":{"code_git_sha":"0000000","family":"dixon_coles","model_id":"synthetic_contract_fixture","params_hash":"5f1b3431408401f9d68b5ee37a843f3618480a2e3689ca58ffcf6791f4e643c6","seed":20260710,"version":"0.1.0"},"provenance":{"created_at_utc":"2030-01-11T18:00:00Z","deterministic":true,"generator":"golavo-sample-fixtures/0.2.0","payload_sha256":"1e205fb3e31da262a91d190acd73f38b5d1b91fd27b96ae55ff95cc099f0cc35"},"schema_version":"0.2.0","status":"sealed","supersedes":null}
