{"artifact_id":"fa_99075100f01df8b2ca24","evaluation":null,"forecast":{"abstain_reason":null,"abstained":false,"expected_goals":null,"horizon":"T-72h","market":"1x2_regulation","probs":{"away":0.24,"draw":0.27,"home":0.49},"sealed_at_utc":"2030-01-12T18:00:00Z","uncertainty":"medium"},"inputs":{"snapshots":[{"license":"CC0-1.0 excerpt; synthetic fields are test-only","retrieved_at_utc":"2030-01-01T00:00:00Z","sha256":"efd0adeb029fa164d1476de54a5a953d0cf7d037ea0bebca92f36a96a6ece9c9","snapshot_id":"sp_synthetic_fixture_v1","source_id":"golavo-synthetic-contract-fixtures","upstream_ref":"phase0-fixtures-v1","url":"https://github.com/udhawan97/Golavo/tree/main/data/fixtures"}],"training_cutoff_utc":"2030-01-12T18:00:00Z"},"match":{"away_team":"Example Away 3","city":"Example City","competition":"Synthetic contract fixture","country":"Example Country","home_team":"Example Home 3","kickoff_utc":"2030-01-13T18:00:00Z","match_id":"m_synthetic_03","neutral_venue":false,"stage":"Acceptance test"},"model":{"code_git_sha":"0000000","family":"elo_ordlogit","model_id":"synthetic_contract_fixture","params_hash":"5f1b3431408401f9d68b5ee37a843f3618480a2e3689ca58ffcf6791f4e643c6","seed":20260710,"version":"0.1.0"},"provenance":{"created_at_utc":"2030-01-12T18:00:00Z","deterministic":true,"generator":"golavo-sample-fixtures/0.2.0","payload_sha256":"7653c8a56ba8be405ffcec42ef24cd3558038f18ced557a70fc8e4f29d64721c"},"schema_version":"0.2.0","status":"sealed","supersedes":null}
